### ISSUE TITLE
Startup crash on Galaxy Nexus (Ice cream sandwich)

### ISSUE THREAD

**Issue by GoogleCodeExporter** [peteaky/android-xbmcremote#581]
```
What steps will reproduce the problem?
1. Install app on device
2. Restore app data from titanium backup
3. Start app

What is the expected output? What do you see instead?
I expect to see the options for movies, TV etc. I see an error as it tries to 
connect  error reads  "NullPointerException". The only option is Close. The app 
says reconnecting, but nothing will cause it to connect.

What version of XBMC Remote are you using?
Latest in market


Which Android device are you using (and which ROM, if custom)?
Galaxy Nexus. Rooted. Stock ICS


Which XBMC revision are you running and on which platform?
10.1 on ubuntu 10.10



Please provide any additional information below.

```

Original issue reported on code.google.com by `steve.ni...@gmail.com` on 20 Nov 2011 at 10:52

**Comment by GoogleCodeExporter** [comment]
```
Same problem but didn't use Titanium restore, stock Android, not rooted and 
running 10.1 on Windows 7
```

Original comment by `Clint.Wi...@googlemail.com` on 26 Nov 2011 at 3:29

**Comment by GoogleCodeExporter** [comment]
```
"NullPointerException" as well on Nexus S device running Kwiboo's custom ICS 
rom v3.
```

Original comment by `francois...@gmail.com` on 28 Nov 2011 at 1:12

**Comment by GoogleCodeExporter** [comment]
```
NPE when selecting a Host on Samsung Vibrant running NeoBuddy's ICS rom v3.  
However, the remote control option still works.  I just can't view the 
Libraries or Now Showing.
```

Original comment by `derek.d....@gmail.com` on 28 Nov 2011 at 5:37

**Comment by GoogleCodeExporter** [comment]
```
I grabbed some logs from such crash. Running latest Market version, stock ICS 
on Nexus S. Looks like some API change.

I/Connection( 7492): 
http://192.168.1.65:8080/xbmcCmds/xbmcHttp?command=GetSystemInfo(120)
W/System.err( 7492): java.io.EOFException
W/System.err( 7492): at libcore.io.Streams.readAsciiLine(Streams.java:203)
W/System.err( 7492): at 
libcore.net.http.HttpEngine.readResponseHeaders(HttpEngine.java:547)
W/System.err( 7492): at 
libcore.net.http.HttpEngine.readResponse(HttpEngine.java:787)
W/System.err( 7492): at 
libcore.net.http.HttpURLConnectionImpl.getResponse(HttpURLConnectionImpl.java:27
4)
W/System.err( 7492): at 
libcore.net.http.HttpURLConnectionImpl.getInputStream(HttpURLConnectionImpl.java
:168)
W/System.err( 7492): at org.xbmc.httpapi.Connection.query(Connection.java:278)
W/System.err( 7492): at 
org.xbmc.httpapi.Connection.getString(Connection.java:313)
W/System.err( 7492): at 
org.xbmc.httpapi.client.InfoClient.getSystemInfo(InfoClient.java:126)
W/System.err( 7492): at 
org.xbmc.android.util.ClientFactory.probeQueryApiType(ClientFactory.java:216)
W/System.err( 7492): at 
org.xbmc.android.util.ClientFactory.getInfoClient(ClientFactory.java:68)
W/System.err( 7492): at 
org.xbmc.android.remote.business.AbstractManager.info(AbstractManager.java:107)
W/System.err( 7492): at 
org.xbmc.android.remote.business.InfoManager$1.doRun(InfoManager.java:51)
W/System.err( 7492): at 
org.xbmc.android.remote.business.Command.run(Command.java:40)
W/System.err( 7492): at android.os.Handler.handleCallback(Handler.java:605)
W/System.err( 7492): at android.os.Handler.dispatchMessage(Handler.java:92)
W/System.err( 7492): at android.os.Looper.loop(Looper.java:137)
W/System.err( 7492): at 
org.xbmc.android.remote.business.ManagerThread.run(ManagerThread.java:78)
W/System.err( 7492): java.lang.NullPointerException
W/System.err( 7492): at 
org.xbmc.android.remote.presentation.controller.AbstractController.onError(Abstr
actController.java:237)
W/System.err( 7492): at 
org.xbmc.android.remote.business.AbstractManager.onError(AbstractManager.java:29
3)
W/System.err( 7492): at org.xbmc.httpapi.Connection.query(Connection.java:298)
W/System.err( 7492): at 
org.xbmc.httpapi.Connection.getString(Connection.java:313)
W/System.err( 7492): at 
org.xbmc.httpapi.client.InfoClient.getSystemInfo(InfoClient.java:126)
W/System.err( 7492): at 
org.xbmc.android.util.ClientFactory.probeQueryApiType(ClientFactory.java:216)
W/System.err( 7492): at 
org.xbmc.android.util.ClientFactory.getInfoClient(ClientFactory.java:68)
W/System.err( 7492): at 
org.xbmc.android.remote.business.AbstractManager.info(AbstractManager.java:107)
W/System.err( 7492): at 
org.xbmc.android.remote.business.InfoManager$1.doRun(InfoManager.java:51)
W/System.err( 7492): at 
org.xbmc.android.remote.business.Command.run(Command.java:40)
W/System.err( 7492): at android.os.Handler.handleCallback(Handler.java:605)
W/System.err( 7492): at android.os.Handler.dispatchMessage(Handler.java:92)
W/System.err( 7492): at android.os.Looper.loop(Looper.java:137)
W/System.err( 7492): at 
org.xbmc.android.remote.business.ManagerThread.run(ManagerThread.java:78)
```

Original comment by `yac...@gmail.com` on 28 Nov 2011 at 9:55

**Comment by GoogleCodeExporter** [comment]
```
Can you try this build and see if this works? 

http://code.google.com/p/android-xbmcremote/downloads/detail?name=XBMC_Remote_v0
.8.7-r2_signed.apk
```

Original comment by `phree...@gmail.com` on 7 Dec 2011 at 10:19

**Comment by GoogleCodeExporter** [comment]
Original comment by `phree...@gmail.com` on 7 Dec 2011 at 10:20
- Changed state: **Accepted**
- Added labels: **Milestone-Release0.8**

**Comment by GoogleCodeExporter** [comment]
```
Just tried it, still NPE.
```

Original comment by `Clint.Wi...@googlemail.com` on 7 Dec 2011 at 10:30

**Comment by GoogleCodeExporter** [comment]
```
Fails in a similar way, but at least the line number is different :)

I/Connection(24876): 
http://192.168.1.65:8080/xbmcCmds/xbmcHttp?command=GetSystemInfo(120)
W/System.err(24876): java.io.EOFException
W/System.err(24876): at libcore.io.Streams.readAsciiLine(Streams.java:203)
W/System.err(24876): at 
libcore.net.http.HttpEngine.readResponseHeaders(HttpEngine.java:547)
W/System.err(24876): at 
libcore.net.http.HttpEngine.readResponse(HttpEngine.java:787)
W/System.err(24876): at 
libcore.net.http.HttpURLConnectionImpl.getResponse(HttpURLConnectionImpl.java:27
4)
W/System.err(24876): at 
libcore.net.http.HttpURLConnectionImpl.getInputStream(HttpURLConnectionImpl.java
:168)
W/System.err(24876): at org.xbmc.httpapi.Connection.query(Connection.java:278)
W/System.err(24876): at 
org.xbmc.httpapi.Connection.getString(Connection.java:313)
W/System.err(24876): at 
org.xbmc.httpapi.client.InfoClient.getSystemInfo(InfoClient.java:126)
W/System.err(24876): at 
org.xbmc.android.util.ClientFactory.probeQueryApiType(ClientFactory.java:214)
W/System.err(24876): at 
org.xbmc.android.util.ClientFactory.getInfoClient(ClientFactory.java:68)
W/System.err(24876): at 
org.xbmc.android.remote.business.AbstractManager.info(AbstractManager.java:107)
W/System.err(24876): at 
org.xbmc.android.remote.business.InfoManager$1.doRun(InfoManager.java:51)
W/System.err(24876): at 
org.xbmc.android.remote.business.Command.run(Command.java:40)
W/System.err(24876): at android.os.Handler.handleCallback(Handler.java:605)
W/System.err(24876): at android.os.Handler.dispatchMessage(Handler.java:92)
W/System.err(24876): at android.os.Looper.loop(Looper.java:137)
W/System.err(24876): at 
org.xbmc.android.remote.business.ManagerThread.run(ManagerThread.java:78)
W/System.err(24876): java.lang.NullPointerException
W/System.err(24876): at 
org.xbmc.android.remote.presentation.controller.AbstractController.onError(Abstr
actController.java:248)
W/System.err(24876): at 
org.xbmc.android.remote.business.AbstractManager.onError(AbstractManager.java:29
3)
W/System.err(24876): at org.xbmc.httpapi.Connection.query(Connection.java:298)
W/System.err(24876): at 
org.xbmc.httpapi.Connection.getString(Connection.java:313)
W/System.err(24876): at 
org.xbmc.httpapi.client.InfoClient.getSystemInfo(InfoClient.java:126)
W/System.err(24876): at 
org.xbmc.android.util.ClientFactory.probeQueryApiType(ClientFactory.java:214)
W/System.err(24876): at 
org.xbmc.android.util.ClientFactory.getInfoClient(ClientFactory.java:68)
W/System.err(24876): at 
org.xbmc.android.remote.business.AbstractManager.info(AbstractManager.java:107)
W/System.err(24876): at 
org.xbmc.android.remote.business.InfoManager$1.doRun(InfoManager.java:51)
W/System.err(24876): at 
org.xbmc.android.remote.business.Command.run(Command.java:40)
W/System.err(24876): at android.os.Handler.handleCallback(Handler.java:605)
W/System.err(24876): at android.os.Handler.dispatchMessage(Handler.java:92)
W/System.err(24876): at android.os.Looper.loop(Looper.java:137)
W/System.err(24876): at 
org.xbmc.android.remote.business.ManagerThread.run(ManagerThread.java:78)
```

Original comment by `yac...@gmail.com` on 7 Dec 2011 at 10:33

**Comment by GoogleCodeExporter** [comment]
```
Same here, nullpointerexceptions but the remote does work fine though.
```

Original comment by `thasypher` on 9 Dec 2011 at 4:28

**Comment by GoogleCodeExporter** [comment]
```
I've found that the first time you add the host from scratch you can use the 
app fine. If you exit and re-launch it crashes with NPE.  
```

Original comment by `adrien.c...@gmail.com` on 11 Dec 2011 at 5:04

**Comment by GoogleCodeExporter** [comment]
```
[deleted comment]
```

**Comment by GoogleCodeExporter** [comment]
```
ICS 4.0.1 (root), Samsung Galaxy Nexus.
Actual remote control works as normal (aside from the random NPE popup)
```

Original comment by `JamieMS...@gmail.com` on 13 Dec 2011 at 10:35

**Comment by GoogleCodeExporter** [comment]
```
Spent a few hours debugging today, still no idea what is happening. For 
reference, here are the links to the mailing list and StackOverflow where I 
asked the question:

http://groups.google.com/group/android-developers/browse_thread/thread/3f4349eb8
b22747a?pli=1
http://stackoverflow.com/questions/8487780/weird-eofexception-on-galaxy-nexus
```

Original comment by `phree...@gmail.com` on 14 Dec 2011 at 7:53

**Comment by GoogleCodeExporter** [comment]
```
FWIW, my logs are from Nexus S, not Galaxy Nexus.
```

Original comment by `yac...@gmail.com` on 14 Dec 2011 at 9:27

**Comment by GoogleCodeExporter** [comment]
```
Check this out. I'm not skilled here, but I think it looked interesting.

https://github.com/boatmeme/microsoft-translator-java-api/issues/27
```

Original comment by `filiptomren` on 15 Dec 2011 at 1:46

**Comment by GoogleCodeExporter** [comment]
```
Well the problem is not the NullPointerException but the EOFException. The NPE 
is just due to the message of the EOFException being null. That can be easily 
fixed, but that would only be fixing the symptoms instead of the real problem.
```

Original comment by `phree...@gmail.com` on 15 Dec 2011 at 10:38

**Comment by GoogleCodeExporter** [comment]
```
@yacoob: interesting. What build are you using? Running the Koush Alpha 11 here 
and I cannot reproduce.
```

Original comment by `phree...@gmail.com` on 15 Dec 2011 at 10:39

**Comment by GoogleCodeExporter** [comment]
```
I'm using the official 4.0.3 build for Nexus S and have this problem.
```

Original comment by `drmattoc...@gmail.com` on 17 Dec 2011 at 11:12

**Comment by GoogleCodeExporter** [comment]
```
Same problem with the Galaxy Nexus
```

Original comment by `jm.dole...@gmail.com` on 17 Dec 2011 at 11:23

**Comment by GoogleCodeExporter** [comment]
```
Please raise the priority: 'medium' does not sound right as this issue 
completely breaks the app.
```

Original comment by `ibatu...@gmail.com` on 18 Dec 2011 at 3:09

**Comment by GoogleCodeExporter** [comment]
```
The r2 version does not fix the problem. Galaxy Nexus stock 4.0.1 rom.
```

Original comment by `mag...@tjerneld.nu` on 18 Dec 2011 at 3:36

**Comment by GoogleCodeExporter** [comment]
```
Yes please raise the priority : it's totaly break on Galaxy Nexus ICS4.01

Thanks.
```

Original comment by `jm.dole...@gmail.com` on 18 Dec 2011 at 11:17

**Comment by GoogleCodeExporter** [comment]
```
[deleted comment]
```

**Comment by GoogleCodeExporter** [comment]
```
Raising the priority won't resolve it faster.
```

Original comment by `phree...@gmail.com` on 19 Dec 2011 at 9:44
- Added labels: **Priority-High**
- Removed labels: **Priority-Medium**

**Comment by GoogleCodeExporter** [comment]
```


I know that it won't be resolved faster. 

But it shows that it's an important bug. The app does'nt function. It's not a 
cosmectic bug.

In any cas, thank you fo your work. 

This app is fantastic ! I used this on Nexus One in the past

```

Original comment by `jm.dole...@gmail.com` on 19 Dec 2011 at 10:01

**Comment by GoogleCodeExporter** [comment]
```
I've got the same problem with my Desire running a custom ICS build.
```

Original comment by `Robert.V...@gmail.com` on 19 Dec 2011 at 2:05

**Comment by GoogleCodeExporter** [comment]
```
same problem on my nexus s ics 4.0.3, i hope for the new version of app, i need 
it for my htpc xD
```

Original comment by `Alessand...@gmail.com` on 19 Dec 2011 at 4:59

**Comment by GoogleCodeExporter** [comment]
```
Same with my Galaxy S 4.0.1 community ROM. 
```

Original comment by `clickher...@gmail.com` on 20 Dec 2011 at 1:43

**Comment by GoogleCodeExporter** [comment]
```
Same problem, Galaxy Nexus, running rooted 4.0.2
```

Original comment by `evand...@gmail.com` on 20 Dec 2011 at 5:08

**Comment by GoogleCodeExporter** [comment]
```
I did some investigation into this crash, and I can't think of anything other 
than that the HttpURLConnection class that is being used is bugged. The 
exception seems a bit intermittent, though on the device it will happen fairly 
regularly.

I tried using the apache HttpClient code instead, with code I basically grabbed 
from 
http://stackoverflow.com/questions/3505930/make-in-http-request-with-android.

That seems to work fine on my Galaxy Nexus with stock ICS.

Here is the Connection.java file with the changes that I made, though it's a 
bit messy. :)
```

Original comment by `brian.fe...@gmail.com` on 22 Dec 2011 at 1:36

Attachments:
- [Connection.java](https://storage.googleapis.com/google-code-attachments/android-xbmcremote/issue-581/comment-30/Connection.java)

**Comment by GoogleCodeExporter** [comment]
```
[deleted comment]
```

**Comment by GoogleCodeExporter** [comment]
```
I've tested your Connection.java on my Galaxy Nexus also running stock ICS 
(4.0.1), and while the remote control still works (as it did with the NPE) I 
know get an error message saying "HTTP 401: Unauthorized". I know it's the 
right username and password, have tested it on a Galaxy SII running 2.3.3.
```

Original comment by `stian.fo...@gmail.com` on 22 Dec 2011 at 6:58

**Comment by GoogleCodeExporter** [comment]
```
Sorry, I suspect that the httpclient isn't sending the cookies for some reason, 
I was running without authentication on my server, I'll check it out tomorrow 
with authentication enabled.
```

Original comment by `brian.fe...@gmail.com` on 22 Dec 2011 at 9:18

**Comment by GoogleCodeExporter** [comment]
```
Ok, looks like XBMC uses basic auth, I have a file that seems to allow both 
authenticated and non-authenticated use, though this probably isn't a good long 
term solution, just putting it out there in case anyone really needs their ICS 
XBMC remote fix.

I did a bit more investigation into why this crash seems to only occur with 
this app even though there doesn't seem to be anything wrong whatsoever with 
the code. One thing I noticed when testing around it was that if I changed the 
url to just point to a standard apache web server I could never get the EOF 
error when reading the response headers, making me suspect there might be 
something about the XBMC http server that the ICS 
HttpURLConnectionImpl/HttpEngine code doesn't like.
```

Original comment by `brian.fe...@gmail.com` on 22 Dec 2011 at 9:50

Attachments:
- [Connection.java](https://storage.googleapis.com/google-code-attachments/android-xbmcremote/issue-581/comment-34/Connection.java)

**Comment by GoogleCodeExporter** [comment]
```
Thanks for the numerous comments and suggestions. Can people with the Nexus S 
specify which ROM they are exactly running? I'll try the new Connection.java 
asap, thanks Brian, however I'll be away during the holidays.

Till, since you've got a Galaxy Nexus now, can you please test this and report 
back? Thanks!
```

Original comment by `phree...@gmail.com` on 23 Dec 2011 at 7:23

**Comment by GoogleCodeExporter** [comment]
```
I've tested it on my Galaxy Nexus and it works with authentication :-)
```

Original comment by `stian.fo...@gmail.com` on 23 Dec 2011 at 7:28

**Comment by GoogleCodeExporter** [comment]
```
My nexus s build is ILM47K. 
```

Original comment by `drmattoc...@gmail.com` on 23 Dec 2011 at 7:54

**Comment by GoogleCodeExporter** [comment]
```
I've had a closer look at the network traffic using Wireshark. It looks to me 
like the HttpURLConnection tries to reuse the connection for subsequent http 
requests, the xbmc http server however does not support persistent connections 
afaict.

The first request from the android client does not contain any authentication 
information, which results in a 401 Unauthorized from the xbmc http server. A 
second request is made on the same connection, this time including the 
authentication header. The xbmc server however has already closed the 
connection, which explains the EOFException.

The actual problem seems to be in the implementation of the xbmc http server. 
According to RFC2616 14.10 non-persistent connections must include the 
'Connection: close' header, which is not send by xbmc. Fixing this should solve 
the problem. It does not only affect the deprecated http api, but also the 
jsonrpc interface over the http transport from what i've seen when testing with 
curl.

Until that is fixed there are a few possible workarounds. The first option is 
to use the apache HttpClient instead, what Brian also suggested. Another 
possibility is to manually add the authentication headers to the http request 
instead of using the Authenticator, so that only a single request will be made 
and hope that it does not try to reuse the connection in other situations.
```

Original comment by `stemmert...@gmail.com` on 23 Dec 2011 at 6:30

**Comment by GoogleCodeExporter** [comment]
```
Inspired by comment 38, I worked around this problem by proxying xbmc through 
nginx.
```

Original comment by `therap...@gmail.com` on 25 Dec 2011 at 10:37

**Comment by GoogleCodeExporter** [comment]
```
#39 you rock

anyone willing to install nginx will need something similar inserted into 
nginx.conf:

8083 is the port my xbmc listens on, 192.168.1.64 is xbmc's ip as set up in the 
remote. Nginx will fail to start if xbmc isn't open when you try and start it

http{
upstream backend  {
  server 127.0.0.1:8083;
}

server {
listen     192.168.1.64:8079;
  location / {
    proxy_pass  http://backend;
  }
}
}
```

Original comment by `dhar...@gmail.com` on 27 Dec 2011 at 1:41

**Comment by GoogleCodeExporter** [comment]
```
Thanks guys, great information. I hope I can sort this out when I get back home 
later today.

Cheers!

```

Original comment by `phree...@gmail.com` on 27 Dec 2011 at 2:43

**Comment by GoogleCodeExporter** [comment]
```
Issue 586 has been merged into this issue.
```

Original comment by `phree...@gmail.com` on 27 Dec 2011 at 3:16

**Comment by GoogleCodeExporter** [comment]
```
Issue 585 has been merged into this issue.
```

Original comment by `phree...@gmail.com` on 27 Dec 2011 at 3:17

**Comment by GoogleCodeExporter** [comment]
```
#39 +1 !
nginx works a treat - full app functionality restored.
```

Original comment by `JamieMS...@gmail.com` on 27 Dec 2011 at 3:37

**Comment by GoogleCodeExporter** [comment]
```
install the app from this link " http://www.multiupload.com/FBN9PHX5CJ " , the 
app run on my nexus s 4.0.3 and for now i haven't problem .
I compiled the app and has been fixed using the fix from comment "33".
maybe this isn't a good long term solution but for now is better of nothing.
all here we are waiting for a offy fix ^^ i hope we will see the new app soon.
```

Original comment by `Alessand...@gmail.com` on 27 Dec 2011 at 5:45

**Comment by GoogleCodeExporter** [comment]
```
Patch from #34 resolve the NPE problem, but now app crashs with an unhandled 
exception  when loading non-existing posters from the library.
```

Original comment by `bogdan.v...@gmail.com` on 27 Dec 2011 at 6:13

Attachments:
- [log.txt](https://storage.googleapis.com/google-code-attachments/android-xbmcremote/issue-581/comment-46/log.txt)

**Comment by GoogleCodeExporter** [comment]
```
#40 I think you can do it simpler, without upstream backend.
Just something like:
server {
  listen addr:port;
  server_name _;

  location / {
    proxy_pass http://localhost:8083;
  }
}
```

Original comment by `therap...@gmail.com` on 27 Dec 2011 at 6:27

**Comment by GoogleCodeExporter** [comment]
```
Had the same problem on my Galaxy Nexus.
Installed the apk posted at comment 45 and it works!
No more -null pointer exception.
Sometimes however the application crashes. Randomly.
```

Original comment by `giucant...@gmail.com` on 28 Dec 2011 at 9:13

**Comment by GoogleCodeExporter** [comment]
```
Ditto on the download in comment 45 working for me on a Galaxy Nexus 4.0.2. I'm 
only connecting locally and on a WPA wireless network so I don't think there's 
anything to worry about. Thanks heaps for the temporary build!
```

Original comment by `n...@neilnz.com` on 28 Dec 2011 at 9:40

**Comment by GoogleCodeExporter** [comment]
```
Okay, I've pushed the new version with Apache client to Github. Will do some 
more tests at home with non-ICS devices, but I don't expect any problems.
```

Original comment by `phree...@gmail.com` on 28 Dec 2011 at 10:26

**Comment by GoogleCodeExporter** [comment]
```
Still crash on 'java.lang.IllegalArgumentException: Base64-encoded string must 
have at least four characters, but length specified was 3' at http thread.
```

Original comment by `bogdan.v...@gmail.com` on 28 Dec 2011 at 3:47

**Comment by GoogleCodeExporter** [comment]
```
Stack trace please.
```

Original comment by `phree...@gmail.com` on 28 Dec 2011 at 3:53

**Comment by GoogleCodeExporter** [comment]
```
Available trace in attachment. If you need more detailed information, please 
tell how to obtain it.
```

Original comment by `bogdan.v...@gmail.com` on 28 Dec 2011 at 4:33

Attachments:
- [xbmcremote.logcat.txt](https://storage.googleapis.com/google-code-attachments/android-xbmcremote/issue-581/comment-53/xbmcremote.logcat.txt)

**Comment by GoogleCodeExporter** [comment]
```
Guys, please try this build:

http://code.google.com/p/android-xbmcremote/downloads/detail?name=XBMC_Remote_v0
.8.7-r3_signed.apk

If by tomorrow evening no more problems are reported, this is going to Android 
Market.
```

Original comment by `phree...@gmail.com` on 28 Dec 2011 at 10:25

**Comment by GoogleCodeExporter** [comment]
```
Browsing library, now playing, send to xbmc all work now. 
But I do get an fc dialog when trying to batch download covers.

Galaxy Nexus with Android 4.0.1 stock
```

Original comment by `codename...@gmail.com` on 28 Dec 2011 at 10:40

**Comment by GoogleCodeExporter** [comment]
```
That's made it even worse for me, just force closes as soon as I try and
open the app.

Galaxy Nexus - Stock Android 4.0.1
```

Original comment by `ben...@gmail.com` on 28 Dec 2011 at 11:17

**Comment by GoogleCodeExporter** [comment]
```
Same here
```

Original comment by `Siebren....@gmail.com` on 28 Dec 2011 at 11:18

**Comment by GoogleCodeExporter** [comment]
```
Those with startup crash, please post a stack trace.
```

Original comment by `phree...@gmail.com` on 28 Dec 2011 at 11:20

**Comment by GoogleCodeExporter** [comment]
```
Did a complete re-install of the app, and now it works just fine !
```

Original comment by `Siebren....@gmail.com` on 28 Dec 2011 at 11:21

**Comment by GoogleCodeExporter** [comment]
```
Working fine here now with very 0.8.7 r3. Thanks.

Nexus S with ICS 4.0.3
```

Original comment by `baz.is...@gmail.com` on 28 Dec 2011 at 11:30

**Comment by GoogleCodeExporter** [comment]
```
Working perfectly. Galaxy Nexus ICS 4.0.2
```

Original comment by `JamieMS...@gmail.com` on 29 Dec 2011 at 12:02

**Comment by GoogleCodeExporter** [comment]
```
I uninstalled completely, and reinstalled that version.. it worked fine until I 
put my settings in, then it just crashes as soon as I try and launch the app 
again.

Here's a log, sorry if it's a little verbose, wasn't sure exactly what to 
include.
```

Original comment by `ben...@gmail.com` on 29 Dec 2011 at 12:09

Attachments:
- [alogcat.2011-12-29-00-01-19+0000.txt](https://storage.googleapis.com/google-code-attachments/android-xbmcremote/issue-581/comment-62/alogcat.2011-12-29-00-01-19+0000.txt)

**Comment by GoogleCodeExporter** [comment]
```
Works for me installing over the top. Galaxy Nexus 4.0.3. Thanks :)
```

Original comment by `hadley.r...@gmail.com` on 29 Dec 2011 at 12:39

**Comment by GoogleCodeExporter** [comment]
```
New version doesnt resolve mac address for IPs and crashes on keypress if using 
hostnames in the config.  All is well if I use IPs for the profiles though.   
Haven't tested WOL yet but will post results.
```

Original comment by `adrien.c...@gmail.com` on 29 Dec 2011 at 12:48

**Comment by GoogleCodeExporter** [comment]
```
Yes, spoke too soon. I get a FC when pressing a key in remote mode.
```

Original comment by `hadley.r...@gmail.com` on 29 Dec 2011 at 12:55

**Comment by GoogleCodeExporter** [comment]
```
I've confirmed that the fix in this build breaks wake on lan functionality.  
```

Original comment by `adrien.c...@gmail.com` on 29 Dec 2011 at 4:47

**Comment by GoogleCodeExporter** [comment]
```
Another confirm that WoL is broken in r3 build.
```

Original comment by `nws...@gmail.com` on 29 Dec 2011 at 4:51

**Comment by GoogleCodeExporter** [comment]
```
I'm experiencing artwork issues with r3, movie/tv posters are only sporadically 
shown and disappears when scrolling. Using the "download posters" function 
causes FC.
```

Original comment by `mag...@tjerneld.nu` on 29 Dec 2011 at 8:32

**Comment by GoogleCodeExporter** [comment]
```
HTC Sensation with ICS based InsertCoin here. XBMC Remote installed from market.
Trying to connect to server:
$ grep 6073 ~/tmp/xbmc-logcat.txt
I/ActivityManager(  257): Start proc org.xbmc.android.remote for activity 
org.xbmc.android.remote/.presentation.activity.HomeActivity: pid=6073 uid=10164 
gids={3003, 1015}
D/memalloc( 6073): map_buffer: Successfully mapped 245760 bytes
D/memalloc( 6073): map_buffer: Successfully mapped 245760 bytes
V/Performance( 6073): 
>>org.xbmc.android.remote.presentation.activity.HomeActivity@40dc34f0 
performSaveInstanceState
V/Performance( 6073): 
<<org.xbmc.android.remote.presentation.activity.HomeActivity@40dc34f0 
performSaveInstanceState, 1ms
V/Performance( 6073): 
>>org.xbmc.android.remote.presentation.activity.HomeActivity@40dc34f0 
performPause
V/Performance( 6073): 
<<org.xbmc.android.remote.presentation.activity.HomeActivity@40dc34f0 
performPause, 0ms
D/dalvikvm( 6073): GC_CONCURRENT freed 250K, 10% free 3240K/3591K, paused 
2ms+28ms
V/Performance( 6073): 
>>org.xbmc.android.remote.presentation.activity.HomeActivity@40dc34f0 onResume
V/Performance( 6073): 
<<org.xbmc.android.remote.presentation.activity.HomeActivity@40dc34f0 onResume, 
0ms
D/Command ( 6073): Running command counter: 1
D/WifiHelper( 6073): WIFI_STATE_CONNECTED to bananacisco
I/Connection( 6073): 
http://192.168.231.222:8080/xbmcCmds/xbmcHttp?command=GetSystemInfo(120)
V/Performance( 6073): 
>>org.xbmc.android.remote.presentation.activity.HomeActivity@40dc34f0 
performSaveInstanceState
V/Performance( 6073): 
<<org.xbmc.android.remote.presentation.activity.HomeActivity@40dc34f0 
performSaveInstanceState, 0ms
V/Performance( 6073): 
>>org.xbmc.android.remote.presentation.activity.HomeActivity@40dc34f0 
performPause
V/Performance( 6073): 
<<org.xbmc.android.remote.presentation.activity.HomeActivity@40dc34f0 
performPause, 0ms
I/ClientFactory( 6073): VERSION = 
I/Connection( 6073): 
http://192.168.231.222:8080/xbmcCmds/xbmcHttp?command=GetSystemInfo(120)
I/Connection( 6073): 
http://192.168.231.222:8080/xbmcCmds/xbmcHttp?command=SetResponseFormat(WebHeade
r;true;WebFooter;true;Header; ;Footer; ;OpenTag;<li>;CloseTag;
I/Connection( 6073): ;CloseFinalTag;false)
I/org.xbmc.android.remote.business.InfoManager( 6073): *** getSystemInfo: 2572ms
W/AbstractManager( 6073): *** ignoring onFinish, controller is null.
V/Performance( 6073): 
>>org.xbmc.android.remote.presentation.activity.HomeActivity@40dc34f0 onResume
V/Performance( 6073): 
<<org.xbmc.android.remote.presentation.activity.HomeActivity@40dc34f0 onResume, 
0ms
D/Command ( 6073): Running command counter: 1
D/WifiHelper( 6073): WIFI_STATE_CONNECTED to bananacisco
I/Connection( 6073): 
http://192.168.231.222:8080/xbmcCmds/xbmcHttp?command=GetSystemInfo(120)
W/System.err( 6073): java.io.EOFException
W/System.err( 6073):    at libcore.io.Streams.readAsciiLine(Streams.java:203)
W/System.err( 6073):    at 
libcore.net.http.HttpEngine.readResponseHeaders(HttpEngine.java:547)
W/System.err( 6073):    at 
libcore.net.http.HttpEngine.readResponse(HttpEngine.java:787)
W/System.err( 6073):    at 
libcore.net.http.HttpURLConnectionImpl.getResponse(HttpURLConnectionImpl.java:27
4)
W/System.err( 6073):    at 
libcore.net.http.HttpURLConnectionImpl.getInputStream(HttpURLConnectionImpl.java
:168)
W/System.err( 6073):    at org.xbmc.httpapi.Connection.query(Connection.java:278)
W/System.err( 6073):    at 
org.xbmc.httpapi.Connection.getString(Connection.java:313)
W/System.err( 6073):    at 
org.xbmc.httpapi.client.InfoClient.getSystemInfo(InfoClient.java:126)
W/System.err( 6073):    at 
org.xbmc.android.util.ClientFactory.probeQueryApiType(ClientFactory.java:216)
W/System.err( 6073):    at 
org.xbmc.android.util.ClientFactory.getInfoClient(ClientFactory.java:68)
W/System.err( 6073):    at 
org.xbmc.android.remote.business.AbstractManager.info(AbstractManager.java:107)
W/System.err( 6073):    at 
org.xbmc.android.remote.business.InfoManager$1.doRun(InfoManager.java:51)
W/System.err( 6073):    at 
org.xbmc.android.remote.business.Command.run(Command.java:40)
W/System.err( 6073):    at android.os.Handler.handleCallback(Handler.java:605)
W/System.err( 6073):    at android.os.Handler.dispatchMessage(Handler.java:92)
W/System.err( 6073):    at android.os.Looper.loop(Looper.java:154)
W/System.err( 6073):    at 
org.xbmc.android.remote.business.ManagerThread.run(ManagerThread.java:78)
W/System.err( 6073): java.lang.NullPointerException
W/System.err( 6073):    at 
org.xbmc.android.remote.presentation.controller.AbstractController.onError(Abstr
actController.java:237)
W/System.err( 6073):    at 
org.xbmc.android.remote.business.AbstractManager.onError(AbstractManager.java:29
3)
W/System.err( 6073):    at org.xbmc.httpapi.Connection.query(Connection.java:298)
W/System.err( 6073):    at 
org.xbmc.httpapi.Connection.getString(Connection.java:313)
W/System.err( 6073):    at 
org.xbmc.httpapi.client.InfoClient.getSystemInfo(InfoClient.java:126)
W/System.err( 6073):    at 
org.xbmc.android.util.ClientFactory.probeQueryApiType(ClientFactory.java:216)
W/System.err( 6073):    at 
org.xbmc.android.util.ClientFactory.getInfoClient(ClientFactory.java:68)
W/System.err( 6073):    at 
org.xbmc.android.remote.business.AbstractManager.info(AbstractManager.java:107)
W/System.err( 6073):    at 
org.xbmc.android.remote.business.InfoManager$1.doRun(InfoManager.java:51)
W/System.err( 6073):    at 
org.xbmc.android.remote.business.Command.run(Command.java:40)
W/System.err( 6073):    at android.os.Handler.handleCallback(Handler.java:605)
W/System.err( 6073):    at android.os.Handler.dispatchMessage(Handler.java:92)
W/System.err( 6073):    at android.os.Looper.loop(Looper.java:154)
W/System.err( 6073):    at 
org.xbmc.android.remote.business.ManagerThread.run(ManagerThread.java:78)
D/memalloc( 6073): map_buffer: Successfully mapped 245760 bytes
D/memalloc( 6073): map_buffer: Successfully mapped 245760 bytes
I/ClientFactory( 6073): Resetting client to 192.168.231.222
W/ClientFactory( 6073): Not updating event client's host because no instance is 
set yet.

Which is absolutely correct since XBMC sends a reset packet right after the GET 
from remote:
11:54:40.719282 IP 192.168.244.120.40475 > 192.168.231.222.8080: Flags [P.], 
seq 244:522, ack 123, win 8177, options [nop,nop,TS val 6680908 ecr 152687698], 
length 278
GET /xbmcCmds/xbmcHttp?command=GetSystemInfo(120) HTTP/1.1
Authorization: Basic eGJtYzp4Ym1j
User-Agent: Dalvik/1.6.0 (Linux; U; Android 4.0.1; HTC Sensation XE with Beats 
Audio Z715e Build/ITL41D)
Host: 192.168.231.222:8080
Connection: Keep-Alive
Accept-Encoding: gzip


11:54:40.719296 IP 192.168.231.222.8080 > 192.168.244.120.40475: Flags [R], seq 
2960103219, win 0, length 0

The same GET from browser or GB device works as expected:
12:00:28.726719 IP 192.168.244.126.47543 > 192.168.231.222.8080: Flags [P.], 
seq 1:253, ack 1, win 2920, options [nop,nop,TS val 29942 ecr 152774801], 
length 252
GET /xbmcCmds/xbmcHttp?command=GetSystemInfo(120) HTTP/1.1
User-Agent: Dalvik/1.4.0 (Linux; U; Android 2.3.3; GT-P1000 Build/GINGERBREAD)
Host: 192.168.231.222:8080
Connection: Keep-Alive
Accept-Encoding: gzip
Authorization: Basic eGJtYzp4Ym1j


12:00:28.726733 IP 192.168.231.222.8080 > 192.168.244.126.47543: Flags [.], ack 
253, win 108, options [nop,nop,TS val 152774864 ecr 29942], length 0
12:00:28.750040 IP 192.168.231.222.8080 > 192.168.244.126.47543: Flags [P.], 
seq 1:113, ack 253, win 108, options [nop,nop,TS val 152774870 ecr 29942], 
length 112
HTTP/1.1 200 OK
Content-Length: 36
Date: Thu, 29 Dec 2011 11:00:28 GMT

<html>
<li>10.1 Git:Unknown
</html>


Can't enable debug on xbmc right now.
```

Original comment by `mtabol...@gmail.com` on 29 Dec 2011 at 11:08

**Comment by GoogleCodeExporter** [comment]
```
Proxying through another web server "solves" the problem. For anyone with 
apache, do:

NameVirtualHost *:8081
Listen 8081

<VirtualHost *:8081>
    <Proxy *>
                AddDefaultCharset off
                Order deny,allow
                Deny from all
                Allow from 192.168
        </Proxy>
    ProxyPass / http://localhost:8080/
    ProxyPassReverse / http://localhost:8080/
</VirtualHost>

So you can use XBMC web server with < ICS devices on 8080 port and ICS devices 
can connect to port 8081.

YMMV
```

Original comment by `mtabol...@gmail.com` on 29 Dec 2011 at 11:32

**Comment by GoogleCodeExporter** [comment]
```
With r3 build i can browse episodes/movies/etc, and use remote control.
I also connect to a host name, not an IP, no problems there.

However when i try to send a keyboard stroke it force closes, ie when in remote 
control mode, press menu and "Send S key" to shutdown the HTPC.
```

Original comment by `bra...@brasse.se` on 29 Dec 2011 at 11:55

**Comment by GoogleCodeExporter** [comment]
```
I need stack traces from people using the -r3 release posted earlier.
I don't need stack traces from the market app.
```

Original comment by `phree...@gmail.com` on 30 Dec 2011 at 7:30

**Comment by GoogleCodeExporter** [comment]
```
#72 : Here is my logcat from when i try to use remote control, in -r3

If you need more information please tell me how to do to obtain it.
```

Original comment by `bra...@brasse.se` on 30 Dec 2011 at 8:37

Attachments:
- [xbmc_logcat.log](https://storage.googleapis.com/google-code-attachments/android-xbmcremote/issue-581/comment-73/xbmc_logcat.log)

**Comment by GoogleCodeExporter** [comment]
```
Thanks, that's what I wanted to see. Coming up with a new fix soon.
```

Original comment by `phree...@gmail.com` on 30 Dec 2011 at 8:47

**Comment by GoogleCodeExporter** [comment]
```
So I'm pretty sure this build will solve the remaining problems. Test it, and 
if by tomorrow there are no show breakers, this will be the next release:

http://code.google.com/p/android-xbmcremote/downloads/detail?name=XBMC_Remote_v0
.8.7-r4_signed.apk
```

Original comment by `phree...@gmail.com` on 2 Jan 2012 at 11:03

**Comment by GoogleCodeExporter** [comment]
```
Thank you, looking good! Working and can connect to xbmc without any hassels.
```

Original comment by `alru.wal...@gmail.com` on 2 Jan 2012 at 11:16

**Comment by GoogleCodeExporter** [comment]
```
Tested and working on Galaxy Nexus Android ICS 4.0.1:
Connecting to XBMC (Eden Beta), List Music/Movies/TV Shows, Play Movie, 
Download Covers, Send Text

No crashes found. Works great!
```

Original comment by `codename...@gmail.com` on 2 Jan 2012 at 11:25

**Comment by GoogleCodeExporter** [comment]
```
Works great! Nexus S, ICS 4.0.3, XBMC 10.1
```

Original comment by `andreykl...@gmail.com` on 3 Jan 2012 at 8:06

**Comment by GoogleCodeExporter** [comment]
```
Wake on LAN works! 
```

Original comment by `adrien.c...@gmail.com` on 3 Jan 2012 at 8:19

**Comment by GoogleCodeExporter** [comment]
```
Everything seems to work for me as well :) great job! Thanks a bunch.
```

Original comment by `bra...@brasse.se` on 3 Jan 2012 at 8:36

**Comment by GoogleCodeExporter** [comment]
```
All the functions work for me, no issues with TV, Movie or the remote control.

One question, if I go into Movies, everything is cool, but the pictures next to 
each movie are just over half the size they should be and leave a large gap 
around the right and bottom. Cosmetic only. In TV though the show banners leave 
a huge gap down the right hand side, the Season placeholders are too small (as 
with the movie pictures), and the indiviual episode pictures are small too. 
This is where the real problem is. The tick that shows whether something has 
been watched or not is now a tiny pixel or 2 in the bottom right corner.

Do I just need to refresh all my cover data, or is this something the wider 
audience are seeing. For the record, this is the r4 client running on a Galaxy 
Nexus itself running stock ICS 4.0.2

Thanks. And thanks for all the work on this. I never expected such a great 
response when I opened the thread. I thought I'd be alone with my problem until 
the mass market caught up to ICS. The effort (especially over the holiday 
period) has been amazing.
```

Original comment by `steve.ni...@gmail.com` on 3 Jan 2012 at 10:12

**Comment by GoogleCodeExporter** [comment]
```
Well, the holiday period is when we all finally have some free time and not 
getting raped by real life work, isn't it. :)

Anyway, thanks for the bug report. The graphical glitches you are describing 
sound unpretty to me. Would you mind opening a new ticket with screenshots for 
this?

Cheers!
```

Original comment by `phree...@gmail.com` on 3 Jan 2012 at 10:25
- Changed state: **Fixed**

**Comment by GoogleCodeExporter** [comment]
```
No problems. It was fixed by clearing the cache and re-downloading the covers. 
No worries.

Thanks again.
```

Original comment by `steve.ni...@gmail.com` on 3 Jan 2012 at 10:29

**Comment by GoogleCodeExporter** [comment]
```
Fixed version is now available in Android Market. Enjoy!
```

Original comment by `phree...@gmail.com` on 3 Jan 2012 at 6:06

**Comment by GoogleCodeExporter** [comment]
```
Issue 588 has been merged into this issue.
```

Original comment by `phree...@gmail.com` on 4 Jan 2012 at 8:43

**Comment by GoogleCodeExporter** [comment]
```
Same error here, NPE

I have a Galaxy S3 and running XMBC on my raspberry Pi.

The remote works just fine tho.
```

Original comment by `mattias....@gmail.com` on 17 Oct 2012 at 6:11

**Comment by GoogleCodeExporter** [comment]
```
Same problem with xbmc server on tablet and remote from android phone (TF300TG 
/ LGL9)
```

Original comment by `p.po...@gmail.com` on 11 Jul 2013 at 4:46

**Comment by GoogleCodeExporter** [comment]
```
same problem with google nexus 4 
android 4.4.4
```

Original comment by `lfernand...@gmail.com` on 3 Jul 2014 at 2:35
